{
  "city_code": "san_diego",
  "city_name": "San Diego",
  "region": "California",
  "date": "2025-03-23",
  "headline": "San Diego Daily News Update",
  "sections": [
    {
      "title": "Introduction",
      "content": "Good morning, San Diego!\n\nThe sun is shining brightly over our beautiful city this morning. The bustling sounds of downtown are echoing through the streets as the scent of the ocean fills the air. Locals are already out and about, enjoying their morning jogs along the Embarcadero and grabbing coffee at their favorite spots in Little Italy. It's shaping up to be another vibrant day in America's Finest City.\n\n**",
      "headline": "**[City Council Approves Major Funding for San Diego's Infrastructure Upgrades]**"
    },
    {
      "title": "Breaking News",
      "content": "**\n\nThe San Diego City Council has approved a significant funding package aimed at revitalizing the city's infrastructure. The $500 million initiative, announced late last night, will focus on improving roads, parks, and public facilities. Mayor Todd Gloria emphasized the importance of these upgrades for the city's growth and quality of life. \"This investment is crucial for ensuring San Diego remains a thriving and attractive place to live and work,\" Gloria stated. The funding will be allocated over the next five years, with priority given to projects in underserved communities.\n\n**"
    },
    {
      "title": "Community Issues",
      "content": "**\n\nSan Diego is taking a major step forward in addressing homelessness with the opening of a new supportive housing complex in the East Village. The complex, funded through a partnership between the city and local non-profits, will provide 150 units of affordable housing along with on-site services such as medical care and job training. Advocates hope this new approach will help alleviate the city's homelessness crisis by providing stable, long-term solutions.\n\n**"
    },
    {
      "title": "Transportation",
      "content": "**"
    },
    {
      "title": "Weather",
      "content": "**\n\nExpect clear skies and plenty of sunshine throughout the day. It's perfect weather for a trip to Balboa Park or a stroll along Mission Beach. Light layers should be comfortable for most outdoor activities, and driving conditions will be ideal for your Sunday adventures.\n\n**"
    },
    {
      "title": "Quick Notes",
      "content": "**\n\n- The San Diego Zoo welcomes a new baby giraffe, born this week to much excitement from visitors and staff alike.\n- Local schools are gearing up for the annual Science Fair, with students showcasing innovative projects at the San Diego Convention Center next weekend.\n- The Padres are kicking off their spring training with high hopes for the upcoming season, drawing crowds of enthusiastic fans to Petco Park.\n- A new mural celebrating San Diego's diverse culture has been unveiled in Barrio Logan, adding a vibrant splash of color to the neighborhood.\n- The San Diego Symphony announces its new season lineup, featuring a mix of classical favorites and contemporary pieces.\n- Beachgoers are reminded to be cautious of strong rip currents expected along the coast this weekend, with lifeguards on high alert.",
      "items": [
        "**",
        "The San Diego Zoo welcomes a new baby giraffe, born this week to much excitement from visitors and staff alike.",
        "Local schools are gearing up for the annual Science Fair, with students showcasing innovative projects at the San Diego Convention Center next weekend.",
        "The Padres are kicking off their spring training with high hopes for the upcoming season, drawing crowds of enthusiastic fans to Petco Park.",
        "A new mural celebrating San Diego's diverse culture has been unveiled in Barrio Logan, adding a vibrant splash of color to the neighborhood.",
        "The San Diego Symphony announces its new season lineup, featuring a mix of classical favorites and contemporary pieces.",
        "Beachgoers are reminded to be cautious of strong rip currents expected along the coast this weekend, with lifeguards on high alert."
      ]
    }
  ],
  "content": "**[City Council Approves Major Funding for San Diego's Infrastructure Upgrades]**\n\nGood morning, San Diego!\n\nThe sun is shining brightly over our beautiful city this morning. The bustling sounds of downtown are echoing through the streets as the scent of the ocean fills the air. Locals are already out and about, enjoying their morning jogs along the Embarcadero and grabbing coffee at their favorite spots in Little Italy. It's shaping up to be another vibrant day in America's Finest City.\n\n**WEATHER UPDATE:**\n\nExpect clear skies and plenty of sunshine throughout the day. It's perfect weather for a trip to Balboa Park or a stroll along Mission Beach. Light layers should be comfortable for most outdoor activities, and driving conditions will be ideal for your Sunday adventures.\n\n**BREAKING NEWS:**\n\nThe San Diego City Council has approved a significant funding package aimed at revitalizing the city's infrastructure. The $500 million initiative, announced late last night, will focus on improving roads, parks, and public facilities. Mayor Todd Gloria emphasized the importance of these upgrades for the city's growth and quality of life. \"This investment is crucial for ensuring San Diego remains a thriving and attractive place to live and work,\" Gloria stated. The funding will be allocated over the next five years, with priority given to projects in underserved communities.\n\n**COMMUNITY ISSUES:**\n\nSan Diego is taking a major step forward in addressing homelessness with the opening of a new supportive housing complex in the East Village. The complex, funded through a partnership between the city and local non-profits, will provide 150 units of affordable housing along with on-site services such as medical care and job training. Advocates hope this new approach will help alleviate the city's homelessness crisis by providing stable, long-term solutions.\n\n**TRANSPORTATION:**\n\nExciting news for commuters and environmental enthusiasts alike: San Diego is expanding its electric vehicle (EV) charging infrastructure. The city has secured a grant to install 50 new charging stations across various neighborhoods, making it easier for residents to adopt electric vehicles. This initiative aligns with San Diego's Climate Action Plan, aiming to reduce greenhouse gas emissions and promote sustainable transportation options.\n\n**QUICK NOTES:**\n\n- The San Diego Zoo welcomes a new baby giraffe, born this week to much excitement from visitors and staff alike.\n- Local schools are gearing up for the annual Science Fair, with students showcasing innovative projects at the San Diego Convention Center next weekend.\n- The Padres are kicking off their spring training with high hopes for the upcoming season, drawing crowds of enthusiastic fans to Petco Park.\n- A new mural celebrating San Diego's diverse culture has been unveiled in Barrio Logan, adding a vibrant splash of color to the neighborhood.\n- The San Diego Symphony announces its new season lineup, featuring a mix of classical favorites and contemporary pieces.\n- Beachgoers are reminded to be cautious of strong rip currents expected along the coast this weekend, with lifeguards on high alert.\n\nStay tuned for more updates, and have a great day, San Diego!\n\n**ARTICLE INFORMATION:**\n\n- City Council Approves $500 Million for Infrastructure Upgrades (San Diego Union-Tribune)\n- New Supportive Housing Complex Opens in East Village (KPBS)\n- San Diego Expands EV Charging Infrastructure with New Grant (Times of San Diego)\n- Baby Giraffe Born at San Diego Zoo (San Diego Zoo Press Release)\n- Annual Science Fair to Showcase Student Innovations (San Diego Unified School District)\n- Padres Spring Training Draws Excited Crowds (MLB.com)\n- New Mural Celebrates San Diego's Diverse Culture (San Diego Reader)\n- San Diego Symphony Announces New Season Lineup (San Diego Symphony)\n- Lifeguards Warn of Strong Rip Currents Along the Coast (NBC San Diego)",
  "sources": [],
  "article_count": 0,
  "status": "active"
}